{
  "schemaVersion": 1,
  "documentation": "README.md",
  "license": "LICENSE",
  "determinism": "deterministic",
  "fixtures": [
    { "id": "valid-review-note", "proposal": "fixtures/valid-proposal.json", "expectedValid": true },
    { "id": "missing-revision", "proposal": "fixtures/invalid-missing-revision.json", "expectedValid": false }
  ],
  "authorityProbes": [
    { "id": "read-project", "capability": "project.read", "expected": "allow" },
    { "id": "propose-project", "capability": "project.propose", "expected": "allow" },
    { "id": "deny-network", "capability": "network.fetch", "target": "doi.org", "expected": "deny" },
    { "id": "deny-other-network", "capability": "network.fetch", "target": "example.net", "expected": "deny" },
    { "id": "deny-drive", "capability": "drive.read", "expected": "deny" }
  ]
}
